{
  "version": "zones.v1",
  "site_id": "rtsp-site",
  "camera_id": "garage-cam-rtsp",
  "image_width": 640,
  "image_height": 480,
  "zones": [
    {
      "zone_id": "entry",
      "label": "Entry",
      "kind": "entrance",
      "polygon": [[0, 60], [640, 60], [640, 180], [0, 180]]
    },
    {
      "zone_id": "main",
      "label": "Main area",
      "kind": "other",
      "polygon": [[0, 180], [640, 180], [640, 420], [0, 420]],
      "capacity_hint": 10
    }
  ]
}
