{
  "version": "zones.v1",
  "site_id": "lab-site-001",
  "camera_id": "cam-primary",
  "image_width": 640,
  "image_height": 480,
  "zones": [
    {
      "zone_id": "table-1",
      "label": "Table 1",
      "kind": "table",
      "polygon": [[40, 200], [180, 200], [180, 360], [40, 360]],
      "capacity_hint": 4
    },
    {
      "zone_id": "table-2",
      "label": "Table 2",
      "kind": "table",
      "polygon": [[220, 200], [360, 200], [360, 360], [220, 360]],
      "capacity_hint": 4
    },
    {
      "zone_id": "entrance-main",
      "label": "Main entrance",
      "kind": "entrance",
      "polygon": [[200, 20], [440, 20], [440, 120], [200, 120]]
    },
    {
      "zone_id": "queue-host",
      "label": "Host queue",
      "kind": "queue",
      "polygon": [[400, 140], [600, 140], [600, 280], [400, 280]]
    }
  ]
}
